{"backend":{"id":"flat-quotient","version":1},"contractVersion":1,"eventTracks":[{"certificate":0,"pathId":"path-0"},{"certificate":1,"pathId":"path-1"},{"certificate":2,"pathId":"path-2"},{"certificate":3,"pathId":"path-3"},{"certificate":4,"pathId":"path-4"},{"certificate":5,"pathId":"path-5"},{"certificate":6,"pathId":"path-6"},{"certificate":7,"pathId":"path-7"},{"certificate":8,"pathId":"path-8"},{"certificate":9,"pathId":"path-9"},{"certificate":10,"pathId":"path-10"},{"certificate":11,"pathId":"path-11"},{"certificate":12,"pathId":"path-12"},{"certificate":13,"pathId":"path-13"},{"certificate":14,"pathId":"path-14"},{"certificate":15,"pathId":"path-15"},{"certificate":16,"pathId":"path-16"},{"certificate":17,"pathId":"path-17"},{"certificate":18,"pathId":"path-18"},{"certificate":19,"pathId":"path-19"},{"certificate":20,"pathId":"path-20"},{"certificate":21,"pathId":"path-21"},{"certificate":22,"pathId":"path-22"},{"certificate":23,"pathId":"path-23"},{"certificate":24,"pathId":"path-0"},{"certificate":25,"pathId":"path-1"},{"certificate":26,"pathId":"path-2"},{"certificate":27,"pathId":"path-3"},{"certificate":28,"pathId":"path-4"},{"certificate":29,"pathId":"path-5"},{"certificate":30,"pathId":"path-6"},{"certificate":31,"pathId":"path-7"},{"certificate":32,"pathId":"path-8"},{"certificate":33,"pathId":"path-9"},{"certificate":34,"pathId":"path-10"},{"certificate":35,"pathId":"path-11"},{"certificate":36,"pathId":"path-12"},{"certificate":37,"pathId":"path-13"},{"certificate":38,"pathId":"path-14"},{"certificate":39,"pathId":"path-15"},{"certificate":40,"pathId":"path-16"},{"certificate":41,"pathId":"path-17"},{"certificate":42,"pathId":"path-18"},{"certificate":43,"pathId":"path-19"},{"certificate":44,"pathId":"path-20"},{"certificate":45,"pathId":"path-21"},{"certificate":46,"pathId":"path-22"},{"certificate":47,"pathId":"path-23"},{"certificate":48,"pathId":"path-0"},{"certificate":49,"pathId":"path-1"},{"certificate":50,"pathId":"path-2"},{"certificate":51,"pathId":"path-3"},{"certificate":52,"pathId":"path-4"},{"certificate":53,"pathId":"path-5"},{"certificate":54,"pathId":"path-6"},{"certificate":55,"pathId":"path-7"},{"certificate":56,"pathId":"path-8"},{"certificate":57,"pathId":"path-9"},{"certificate":58,"pathId":"path-10"},{"certificate":59,"pathId":"path-11"},{"certificate":60,"pathId":"path-12"},{"certificate":61,"pathId":"path-13"},{"certificate":62,"pathId":"path-14"},{"certificate":63,"pathId":"path-15"},{"certificate":64,"pathId":"path-16"},{"certificate":65,"pathId":"path-17"},{"certificate":66,"pathId":"path-18"},{"certificate":67,"pathId":"path-19"},{"certificate":68,"pathId":"path-20"},{"certificate":69,"pathId":"path-21"},{"certificate":70,"pathId":"path-22"},{"certificate":71,"pathId":"path-23"},{"certificate":72,"pathId":"path-0"},{"certificate":73,"pathId":"path-1"},{"certificate":74,"pathId":"path-2"},{"certificate":75,"pathId":"path-3"},{"certificate":76,"pathId":"path-4"},{"certificate":77,"pathId":"path-5"},{"certificate":78,"pathId":"path-6"},{"certificate":79,"pathId":"path-7"},{"certificate":80,"pathId":"path-8"},{"certificate":81,"pathId":"path-9"},{"certificate":82,"pathId":"path-10"},{"certificate":83,"pathId":"path-11"},{"certificate":84,"pathId":"path-12"},{"certificate":85,"pathId":"path-13"},{"certificate":86,"pathId":"path-14"},{"certificate":87,"pathId":"path-15"},{"certificate":88,"pathId":"path-16"},{"certificate":89,"pathId":"path-17"},{"certificate":90,"pathId":"path-18"},{"certificate":91,"pathId":"path-19"},{"certificate":92,"pathId":"path-20"},{"certificate":93,"pathId":"path-21"},{"certificate":94,"pathId":"path-22"},{"certificate":95,"pathId":"path-23"}],"id":"flat-333-6-v1","interpretationDigest":"cb32731b69051c739ad768a4255f6e68932faa5b7046d56613e9c4f25e3bbab3","kind":"twisty-realization","payload":{"path":"geometry.json","sha256":"bd77b80c449b23aeb817fdc35ab055b66fd14582668543a594cd0471ea0e92a6"},"realizationDigest":"6d522465436693b99f9b202f51b8690aa062419c49403d6b51a889aa3bcacc1e","requiredCapabilities":["quotient-orbifold","quotient-surface","rigid-transforms","triangle-meshes"]}
