{"backend":{"id":"cube-euclidean","version":1},"contractVersion":1,"eventTracks":[{"certificate":0,"pathId":"path-0"},{"certificate":1,"pathId":"path-1"},{"certificate":2,"pathId":"path-2"},{"certificate":3,"pathId":"path-3"},{"certificate":4,"pathId":"path-4"},{"certificate":5,"pathId":"path-5"},{"certificate":6,"pathId":"path-6"},{"certificate":7,"pathId":"path-7"},{"certificate":8,"pathId":"path-8"},{"certificate":9,"pathId":"path-9"},{"certificate":10,"pathId":"path-10"},{"certificate":11,"pathId":"path-11"},{"certificate":12,"pathId":"path-0"},{"certificate":13,"pathId":"path-1"},{"certificate":14,"pathId":"path-2"},{"certificate":15,"pathId":"path-3"},{"certificate":16,"pathId":"path-4"},{"certificate":17,"pathId":"path-5"},{"certificate":18,"pathId":"path-6"},{"certificate":19,"pathId":"path-7"},{"certificate":20,"pathId":"path-8"},{"certificate":21,"pathId":"path-9"},{"certificate":22,"pathId":"path-10"},{"certificate":23,"pathId":"path-11"},{"certificate":24,"pathId":"path-0"},{"certificate":25,"pathId":"path-1"},{"certificate":26,"pathId":"path-2"},{"certificate":27,"pathId":"path-3"},{"certificate":28,"pathId":"path-4"},{"certificate":29,"pathId":"path-5"},{"certificate":30,"pathId":"path-6"},{"certificate":31,"pathId":"path-7"},{"certificate":32,"pathId":"path-8"},{"certificate":33,"pathId":"path-9"},{"certificate":34,"pathId":"path-10"},{"certificate":35,"pathId":"path-11"}],"id":"cube3-cube-euclidean-v1","interpretationDigest":"c10c8b186902ff09d15034f44257f08c711c45e86adad545a1d9d0e4fa63c067","kind":"twisty-realization","payload":{"path":"geometry.json","sha256":"15df2a1d00dace62fedf0737d32743ce264a5cbd92afc25bc68c057595f422c6"},"realizationDigest":"f5e4a06588742dae6945c45465a70ed6ace5abdbf90a7eef654fc7f8a1ccc6f0","requiredCapabilities":["explicit-cube-tracks","rigid-transforms","triangle-meshes"]}
