{"backend":{"id":"flat-quotient","version":1},"contractVersion":1,"eventTracks":[{"certificate":0,"pathId":"path-0"},{"certificate":1,"pathId":"path-1"},{"certificate":2,"pathId":"path-2"},{"certificate":3,"pathId":"path-3"},{"certificate":4,"pathId":"path-4"},{"certificate":5,"pathId":"path-5"},{"certificate":6,"pathId":"path-6"},{"certificate":7,"pathId":"path-7"},{"certificate":8,"pathId":"path-8"},{"certificate":9,"pathId":"path-9"},{"certificate":10,"pathId":"path-10"},{"certificate":11,"pathId":"path-11"},{"certificate":12,"pathId":"path-12"},{"certificate":13,"pathId":"path-13"},{"certificate":14,"pathId":"path-14"},{"certificate":15,"pathId":"path-15"},{"certificate":16,"pathId":"path-16"},{"certificate":17,"pathId":"path-17"},{"certificate":18,"pathId":"path-18"},{"certificate":19,"pathId":"path-19"},{"certificate":20,"pathId":"path-0"},{"certificate":21,"pathId":"path-1"},{"certificate":22,"pathId":"path-2"},{"certificate":23,"pathId":"path-3"},{"certificate":24,"pathId":"path-4"},{"certificate":25,"pathId":"path-5"},{"certificate":26,"pathId":"path-6"},{"certificate":27,"pathId":"path-7"},{"certificate":28,"pathId":"path-8"},{"certificate":29,"pathId":"path-9"},{"certificate":30,"pathId":"path-10"},{"certificate":31,"pathId":"path-11"},{"certificate":32,"pathId":"path-12"},{"certificate":33,"pathId":"path-13"},{"certificate":34,"pathId":"path-14"},{"certificate":35,"pathId":"path-15"},{"certificate":36,"pathId":"path-16"},{"certificate":37,"pathId":"path-17"},{"certificate":38,"pathId":"path-18"},{"certificate":39,"pathId":"path-19"},{"certificate":40,"pathId":"path-0"},{"certificate":41,"pathId":"path-1"},{"certificate":42,"pathId":"path-2"},{"certificate":43,"pathId":"path-3"},{"certificate":44,"pathId":"path-4"},{"certificate":45,"pathId":"path-5"},{"certificate":46,"pathId":"path-6"},{"certificate":47,"pathId":"path-7"},{"certificate":48,"pathId":"path-8"},{"certificate":49,"pathId":"path-9"},{"certificate":50,"pathId":"path-10"},{"certificate":51,"pathId":"path-11"},{"certificate":52,"pathId":"path-12"},{"certificate":53,"pathId":"path-13"},{"certificate":54,"pathId":"path-14"},{"certificate":55,"pathId":"path-15"},{"certificate":56,"pathId":"path-16"},{"certificate":57,"pathId":"path-17"},{"certificate":58,"pathId":"path-18"},{"certificate":59,"pathId":"path-19"}],"id":"flat-hex-klein-bottle-v1","interpretationDigest":"9a4754cb48da6142dc5d514a16b81f98bdc45cb22470a49446bc41f4a64ff45e","kind":"twisty-realization","payload":{"path":"geometry.json","sha256":"040e8aacf2c3ac8295b61cd82d3295340f1d9470158148332027fd6b3a6186ba"},"realizationDigest":"72709c30e69eee15bbcda6f2ce6dd0d0acf71b9af01de330d38341091a45b72d","requiredCapabilities":["quotient-surface","rigid-transforms","triangle-meshes"]}
