{"backend":{"id":"polyhedral-euclidean","version":1},"contractVersion":1,"eventTracks":[{"certificate":0,"pathId":"path-0"},{"certificate":1,"pathId":"path-1"},{"certificate":2,"pathId":"path-2"},{"certificate":3,"pathId":"path-3"},{"certificate":4,"pathId":"path-4"},{"certificate":5,"pathId":"path-5"},{"certificate":6,"pathId":"path-6"},{"certificate":7,"pathId":"path-7"},{"certificate":8,"pathId":"path-8"},{"certificate":9,"pathId":"path-9"},{"certificate":10,"pathId":"path-10"},{"certificate":11,"pathId":"path-11"},{"certificate":12,"pathId":"path-12"},{"certificate":13,"pathId":"path-13"},{"certificate":14,"pathId":"path-14"},{"certificate":15,"pathId":"path-15"},{"certificate":16,"pathId":"path-16"},{"certificate":17,"pathId":"path-17"},{"certificate":18,"pathId":"path-18"},{"certificate":19,"pathId":"path-19"},{"certificate":20,"pathId":"path-20"},{"certificate":21,"pathId":"path-21"},{"certificate":22,"pathId":"path-22"},{"certificate":23,"pathId":"path-23"},{"certificate":24,"pathId":"path-24"},{"certificate":25,"pathId":"path-25"},{"certificate":26,"pathId":"path-26"},{"certificate":27,"pathId":"path-27"},{"certificate":28,"pathId":"path-28"},{"certificate":29,"pathId":"path-29"},{"certificate":30,"pathId":"path-0"},{"certificate":31,"pathId":"path-1"},{"certificate":32,"pathId":"path-2"},{"certificate":33,"pathId":"path-3"},{"certificate":34,"pathId":"path-4"},{"certificate":35,"pathId":"path-5"},{"certificate":36,"pathId":"path-6"},{"certificate":37,"pathId":"path-7"},{"certificate":38,"pathId":"path-8"},{"certificate":39,"pathId":"path-9"},{"certificate":40,"pathId":"path-10"},{"certificate":41,"pathId":"path-11"},{"certificate":42,"pathId":"path-12"},{"certificate":43,"pathId":"path-13"},{"certificate":44,"pathId":"path-14"},{"certificate":45,"pathId":"path-15"},{"certificate":46,"pathId":"path-16"},{"certificate":47,"pathId":"path-17"},{"certificate":48,"pathId":"path-18"},{"certificate":49,"pathId":"path-19"},{"certificate":50,"pathId":"path-20"},{"certificate":51,"pathId":"path-21"},{"certificate":52,"pathId":"path-22"},{"certificate":53,"pathId":"path-23"},{"certificate":54,"pathId":"path-24"},{"certificate":55,"pathId":"path-25"},{"certificate":56,"pathId":"path-26"},{"certificate":57,"pathId":"path-27"},{"certificate":58,"pathId":"path-28"},{"certificate":59,"pathId":"path-29"},{"certificate":60,"pathId":"path-0"},{"certificate":61,"pathId":"path-1"},{"certificate":62,"pathId":"path-2"},{"certificate":63,"pathId":"path-3"},{"certificate":64,"pathId":"path-4"},{"certificate":65,"pathId":"path-5"},{"certificate":66,"pathId":"path-6"},{"certificate":67,"pathId":"path-7"},{"certificate":68,"pathId":"path-8"},{"certificate":69,"pathId":"path-9"},{"certificate":70,"pathId":"path-10"},{"certificate":71,"pathId":"path-11"},{"certificate":72,"pathId":"path-12"},{"certificate":73,"pathId":"path-13"},{"certificate":74,"pathId":"path-14"},{"certificate":75,"pathId":"path-15"},{"certificate":76,"pathId":"path-16"},{"certificate":77,"pathId":"path-17"},{"certificate":78,"pathId":"path-18"},{"certificate":79,"pathId":"path-19"},{"certificate":80,"pathId":"path-20"},{"certificate":81,"pathId":"path-21"},{"certificate":82,"pathId":"path-22"},{"certificate":83,"pathId":"path-23"},{"certificate":84,"pathId":"path-24"},{"certificate":85,"pathId":"path-25"},{"certificate":86,"pathId":"path-26"},{"certificate":87,"pathId":"path-27"},{"certificate":88,"pathId":"path-28"},{"certificate":89,"pathId":"path-29"},{"certificate":90,"pathId":"path-0"},{"certificate":91,"pathId":"path-1"},{"certificate":92,"pathId":"path-2"},{"certificate":93,"pathId":"path-3"},{"certificate":94,"pathId":"path-4"},{"certificate":95,"pathId":"path-5"},{"certificate":96,"pathId":"path-6"},{"certificate":97,"pathId":"path-7"},{"certificate":98,"pathId":"path-8"},{"certificate":99,"pathId":"path-9"},{"certificate":100,"pathId":"path-10"},{"certificate":101,"pathId":"path-11"},{"certificate":102,"pathId":"path-12"},{"certificate":103,"pathId":"path-13"},{"certificate":104,"pathId":"path-14"},{"certificate":105,"pathId":"path-15"},{"certificate":106,"pathId":"path-16"},{"certificate":107,"pathId":"path-17"},{"certificate":108,"pathId":"path-18"},{"certificate":109,"pathId":"path-19"},{"certificate":110,"pathId":"path-20"},{"certificate":111,"pathId":"path-21"},{"certificate":112,"pathId":"path-22"},{"certificate":113,"pathId":"path-23"},{"certificate":114,"pathId":"path-24"},{"certificate":115,"pathId":"path-25"},{"certificate":116,"pathId":"path-26"},{"certificate":117,"pathId":"path-27"},{"certificate":118,"pathId":"path-28"},{"certificate":119,"pathId":"path-29"},{"certificate":120,"pathId":"path-0"},{"certificate":121,"pathId":"path-1"},{"certificate":122,"pathId":"path-2"},{"certificate":123,"pathId":"path-3"},{"certificate":124,"pathId":"path-4"},{"certificate":125,"pathId":"path-5"},{"certificate":126,"pathId":"path-6"},{"certificate":127,"pathId":"path-7"},{"certificate":128,"pathId":"path-8"},{"certificate":129,"pathId":"path-9"},{"certificate":130,"pathId":"path-10"},{"certificate":131,"pathId":"path-11"},{"certificate":132,"pathId":"path-12"},{"certificate":133,"pathId":"path-13"},{"certificate":134,"pathId":"path-14"},{"certificate":135,"pathId":"path-15"},{"certificate":136,"pathId":"path-16"},{"certificate":137,"pathId":"path-17"},{"certificate":138,"pathId":"path-18"},{"certificate":139,"pathId":"path-19"},{"certificate":140,"pathId":"path-20"},{"certificate":141,"pathId":"path-21"},{"certificate":142,"pathId":"path-22"},{"certificate":143,"pathId":"path-23"},{"certificate":144,"pathId":"path-24"},{"certificate":145,"pathId":"path-25"},{"certificate":146,"pathId":"path-26"},{"certificate":147,"pathId":"path-27"},{"certificate":148,"pathId":"path-28"},{"certificate":149,"pathId":"path-29"},{"certificate":150,"pathId":"path-0"},{"certificate":151,"pathId":"path-1"},{"certificate":152,"pathId":"path-2"},{"certificate":153,"pathId":"path-3"},{"certificate":154,"pathId":"path-4"},{"certificate":155,"pathId":"path-5"},{"certificate":156,"pathId":"path-6"},{"certificate":157,"pathId":"path-7"},{"certificate":158,"pathId":"path-8"},{"certificate":159,"pathId":"path-9"},{"certificate":160,"pathId":"path-10"},{"certificate":161,"pathId":"path-11"},{"certificate":162,"pathId":"path-12"},{"certificate":163,"pathId":"path-13"},{"certificate":164,"pathId":"path-14"},{"certificate":165,"pathId":"path-15"},{"certificate":166,"pathId":"path-16"},{"certificate":167,"pathId":"path-17"},{"certificate":168,"pathId":"path-18"},{"certificate":169,"pathId":"path-19"},{"certificate":170,"pathId":"path-20"},{"certificate":171,"pathId":"path-21"},{"certificate":172,"pathId":"path-22"},{"certificate":173,"pathId":"path-23"},{"certificate":174,"pathId":"path-24"},{"certificate":175,"pathId":"path-25"},{"certificate":176,"pathId":"path-26"},{"certificate":177,"pathId":"path-27"},{"certificate":178,"pathId":"path-28"},{"certificate":179,"pathId":"path-29"},{"certificate":180,"pathId":"path-0"},{"certificate":181,"pathId":"path-1"},{"certificate":182,"pathId":"path-2"},{"certificate":183,"pathId":"path-3"},{"certificate":184,"pathId":"path-4"},{"certificate":185,"pathId":"path-5"},{"certificate":186,"pathId":"path-6"},{"certificate":187,"pathId":"path-7"},{"certificate":188,"pathId":"path-8"},{"certificate":189,"pathId":"path-9"},{"certificate":190,"pathId":"path-10"},{"certificate":191,"pathId":"path-11"},{"certificate":192,"pathId":"path-12"},{"certificate":193,"pathId":"path-13"},{"certificate":194,"pathId":"path-14"},{"certificate":195,"pathId":"path-15"},{"certificate":196,"pathId":"path-16"},{"certificate":197,"pathId":"path-17"},{"certificate":198,"pathId":"path-18"},{"certificate":199,"pathId":"path-19"},{"certificate":200,"pathId":"path-20"},{"certificate":201,"pathId":"path-21"},{"certificate":202,"pathId":"path-22"},{"certificate":203,"pathId":"path-23"},{"certificate":204,"pathId":"path-24"},{"certificate":205,"pathId":"path-25"},{"certificate":206,"pathId":"path-26"},{"certificate":207,"pathId":"path-27"},{"certificate":208,"pathId":"path-28"},{"certificate":209,"pathId":"path-29"},{"certificate":210,"pathId":"path-0"},{"certificate":211,"pathId":"path-1"},{"certificate":212,"pathId":"path-2"},{"certificate":213,"pathId":"path-3"},{"certificate":214,"pathId":"path-4"},{"certificate":215,"pathId":"path-5"},{"certificate":216,"pathId":"path-6"},{"certificate":217,"pathId":"path-7"},{"certificate":218,"pathId":"path-8"},{"certificate":219,"pathId":"path-9"},{"certificate":220,"pathId":"path-10"},{"certificate":221,"pathId":"path-11"},{"certificate":222,"pathId":"path-12"},{"certificate":223,"pathId":"path-13"},{"certificate":224,"pathId":"path-14"},{"certificate":225,"pathId":"path-15"},{"certificate":226,"pathId":"path-16"},{"certificate":227,"pathId":"path-17"},{"certificate":228,"pathId":"path-18"},{"certificate":229,"pathId":"path-19"},{"certificate":230,"pathId":"path-20"},{"certificate":231,"pathId":"path-21"},{"certificate":232,"pathId":"path-22"},{"certificate":233,"pathId":"path-23"},{"certificate":234,"pathId":"path-24"},{"certificate":235,"pathId":"path-25"},{"certificate":236,"pathId":"path-26"},{"certificate":237,"pathId":"path-27"},{"certificate":238,"pathId":"path-28"},{"certificate":239,"pathId":"path-29"}],"id":"bagua-euclidean-v1","interpretationDigest":"94416cf68bdb13e217e8defa7a6f248ad63bcf9290d123d2ac6951afd24a85a5","kind":"twisty-realization","payload":{"path":"geometry.json","sha256":"6a8ee2a441f9bd2e7b032d7761e6022738744a69b853019bbae0b9d18473b486"},"realizationDigest":"bcf0b6863cc05b98962ff3c9e56e4410dacd09a4331970d7e84ab0a6dd791c8f","requiredCapabilities":["rigid-transforms","triangle-meshes"]}
