{"backend":{"id":"flat-quotient","version":1},"contractVersion":1,"eventTracks":[{"certificate":0,"pathId":"path-0"},{"certificate":1,"pathId":"path-1"},{"certificate":2,"pathId":"path-2"},{"certificate":3,"pathId":"path-3"},{"certificate":4,"pathId":"path-4"},{"certificate":5,"pathId":"path-5"},{"certificate":6,"pathId":"path-6"},{"certificate":7,"pathId":"path-7"},{"certificate":8,"pathId":"path-8"},{"certificate":9,"pathId":"path-9"},{"certificate":10,"pathId":"path-10"},{"certificate":11,"pathId":"path-11"},{"certificate":12,"pathId":"path-0"},{"certificate":13,"pathId":"path-1"},{"certificate":14,"pathId":"path-2"},{"certificate":15,"pathId":"path-3"},{"certificate":16,"pathId":"path-4"},{"certificate":17,"pathId":"path-5"},{"certificate":18,"pathId":"path-6"},{"certificate":19,"pathId":"path-7"},{"certificate":20,"pathId":"path-8"},{"certificate":21,"pathId":"path-9"},{"certificate":22,"pathId":"path-10"},{"certificate":23,"pathId":"path-11"},{"certificate":24,"pathId":"path-0"},{"certificate":25,"pathId":"path-1"},{"certificate":26,"pathId":"path-2"},{"certificate":27,"pathId":"path-3"},{"certificate":28,"pathId":"path-4"},{"certificate":29,"pathId":"path-5"},{"certificate":30,"pathId":"path-6"},{"certificate":31,"pathId":"path-7"},{"certificate":32,"pathId":"path-8"},{"certificate":33,"pathId":"path-9"},{"certificate":34,"pathId":"path-10"},{"certificate":35,"pathId":"path-11"},{"certificate":36,"pathId":"path-0"},{"certificate":37,"pathId":"path-1"},{"certificate":38,"pathId":"path-2"},{"certificate":39,"pathId":"path-3"},{"certificate":40,"pathId":"path-4"},{"certificate":41,"pathId":"path-5"},{"certificate":42,"pathId":"path-6"},{"certificate":43,"pathId":"path-7"},{"certificate":44,"pathId":"path-8"},{"certificate":45,"pathId":"path-9"},{"certificate":46,"pathId":"path-10"},{"certificate":47,"pathId":"path-11"}],"id":"flat-pillowcase-v1","interpretationDigest":"ccd91a304b4fbba2e4e93999eee4ed0119da5f307e052a78bbbb8e004ce5bfb0","kind":"twisty-realization","payload":{"path":"geometry.json","sha256":"0bf2f8cc53f48965d8ff5e4d68a6248311d9741362eb9ea64914eec5d420f639"},"realizationDigest":"f61a750833fe22ae14be029054965892fdcbfd79fa298fd981b1eb2c97e9a2d3","requiredCapabilities":["quotient-orbifold","quotient-surface","rigid-transforms","triangle-meshes"]}
