{"backend":{"id":"flat-quotient","version":1},"contractVersion":1,"eventTracks":[{"certificate":0,"pathId":"path-0"},{"certificate":1,"pathId":"path-1"},{"certificate":2,"pathId":"path-2"},{"certificate":3,"pathId":"path-3"},{"certificate":4,"pathId":"path-4"},{"certificate":5,"pathId":"path-5"},{"certificate":6,"pathId":"path-6"},{"certificate":7,"pathId":"path-7"},{"certificate":8,"pathId":"path-8"},{"certificate":9,"pathId":"path-0"},{"certificate":10,"pathId":"path-1"},{"certificate":11,"pathId":"path-2"},{"certificate":12,"pathId":"path-3"},{"certificate":13,"pathId":"path-4"},{"certificate":14,"pathId":"path-5"},{"certificate":15,"pathId":"path-6"},{"certificate":16,"pathId":"path-7"},{"certificate":17,"pathId":"path-8"},{"certificate":18,"pathId":"path-0"},{"certificate":19,"pathId":"path-1"},{"certificate":20,"pathId":"path-2"},{"certificate":21,"pathId":"path-3"},{"certificate":22,"pathId":"path-4"},{"certificate":23,"pathId":"path-5"},{"certificate":24,"pathId":"path-6"},{"certificate":25,"pathId":"path-7"},{"certificate":26,"pathId":"path-8"}],"id":"flat-333-v1","interpretationDigest":"1d70d7bddc6a639f16c8b8cf9b78c2dc213f9140dd06a6eda7286d1e283b2f33","kind":"twisty-realization","payload":{"path":"geometry.json","sha256":"54425a68c50d562ce18672dbb46bbf6b99546380117f3f906bbc50a046093503"},"realizationDigest":"23c5ca41138cfae8b31bd543b62f9fb292af9bb1c6e9e0544d5c3c4b2b933ebb","requiredCapabilities":["quotient-orbifold","quotient-surface","rigid-transforms","triangle-meshes"]}
